title,cluster
the simple step journey to gett an rfc,1
grippe aviaire estelle prochaine pandemie,2
apple tv prouve monetiser pub,1
covid chercheurs russes veulent etablir duree persistance virus lorganisme,3
coronavirus europe louest mortalite moindre pays reponse sanitaire rapide,1
etait general igor kirillov heraut desinformation russe tue mardi moscou,3
simpson fetent ans anecdotes connaissez peutetre serie americaine,1
rongeur prospere dunes dubai experts savent arrive,1
replacer tournai carte bd festival tournailesbulles,1
video ticketsrestaurant vontils bientot disparaitre,1
record tableau magritte millions dollars encheres new york,2
covid spf sante presente plan hivernal infections respiratoires,2
carte epidemies grippe bronchiolite continuent progresser france,2
linstitut pasteur traite petaoctets donnees adn heures grace aws,1
originaire brabant flamand lhomme age belgique decede ans,0
grand prix chine calendrier formule jusquen,1
test dyson ontrac lair chanson,0
cancers covid ouvre pistes traitements,3
simpson fetent ans anecdotes connaissez peutetre serie americaine,1
montsaintguibert padel anciennes brasseries vieuxtemps,0
bouffioulx lamenagement parc fours poterie dubois commencer janvier fevrier,0
voyager japon analyser impacts economiques tourisme local,2
communique presse examen accelere accorde etatsunis candidatsvaccins combines prevention grippe covid,2
covid etude fondatrice defendue didier raoult lusage lhydroxychloroquine invalidee,0
ans legalisation realite contrastee lavortement france,2
coronavirus chat traitement autorise france combattre maladie fatale,3
alexander croo homme politique present jt flamands,2
covid rapport americain defend lhypothese fuite dun labo chinois,2
parc fours poterie dubois bouffioulx amenage debut dici festivites fin dannee,0
covid rapport americain relance these fuite dun laboratoire,2
cancers covid ouvre pistes lutte tumeurs,0
covid lechec strategie vaccinale enfants france,3
peur normal,2
top recherches google france,2
transmission lhumain risque pandemie vaccin savoir virus hn,1
taux pourraton emprunter largent possibilites baisse court terme,0
ca moment acheter quil faut attendre credits hypothecaires,1
accord pandemies percee negociations,2
attrapeton froid hiver,1
passes hommes detat belgique,3
fragile temoignage connor reed lhomme attrape covid monde,1
actualite cheval troie lia lecole inquiete professeurs parents deleves,1
langue francaise bourdes repetition demmanuel macron,3
ados heureux sentir quils influencer avenir,1
cheres amies betes depensent prix semaines seychelles,1
tableau magritte vendu encheres montant record millions dollars,2
covid atil vraiment pousse italiens villes,2
etatsunis rapport congres affirme covid provient dune fuite dun laboratoire,2
coup grace didier raoult etude phare lhydroxychloroquine retiree,0
terme fasciste aujourdhui totalement devoye menace democratie,1
brochure glissee cartable enfants scandalise parents simplement scandaleux,3
academie francaise definitions fausses fellation cunnilingus dictionnaire scandaleux,3
lhomme neandertal cohabite ans,1
remboursement pge grand impense debat budget,1
stalker nest souffrance faut defendre,3
